{
  "schema_version": "appworld-codex-plan-v1",
  "status": "candidate",
  "failure_reason": "",
  "missing_public_schema_fields": [],
  "task_id": "d0b1f43_3",
  "task_family": "d0b1f43",
  "completion_mode": "answer_variable",
  "plan_summary": "Inspect the required public contracts, authenticate without exposing secrets, enumerate roommate contacts and all matching Venmo transaction pages since March 1, compute the combined sent-or-received amount, and submit the derived answer.",
  "steps": [
    {
      "step_index": 1,
      "phase": "inspect",
      "reasoning": "Before calling any task API, inspect every required public API contract so later calls use only documented parameters and response fields.",
      "action_code": "required_task_apis = [('supervisor', 'complete_task'), ('supervisor', 'show_account_passwords'), ('supervisor', 'show_profile'), ('phone', 'get_current_date_and_time'), ('phone', 'login'), ('phone', 'search_contacts'), ('venmo', 'login'), ('venmo', 'show_transactions')]\npublic_api_docs = {}\nfor app_name, api_name in required_task_apis:\n    public_api_docs[f'{app_name}.{api_name}'] = apis.api_docs.show_api_doc(app_name=app_name, api_name=api_name)",
      "depends_on_steps": [],
      "api_names_used": [
        "api_docs.show_api_doc"
      ],
      "mutates_state": false,
      "verification_targets": [
        "Public documentation is retrieved for every required task API before its first use."
      ],
      "output_policy": "no_print"
    },
    {
      "step_index": 2,
      "phase": "authenticate",
      "reasoning": "With the contracts inspected, retrieve the runtime clock, supervisor identity, and account-password inventory needed to derive the date boundary and authenticate both apps.",
      "action_code": "current_date_and_time = apis.phone.get_current_date_and_time()\nsupervisor_profile = apis.supervisor.show_profile()\naccount_passwords = apis.supervisor.show_account_passwords()",
      "depends_on_steps": [
        1
      ],
      "api_names_used": [
        "phone.get_current_date_and_time",
        "supervisor.show_profile",
        "supervisor.show_account_passwords"
      ],
      "mutates_state": false,
      "verification_targets": [
        "Runtime date/time is saved.",
        "Supervisor email and phone number are saved.",
        "Password records are saved without printing secrets."
      ],
      "output_policy": "no_print"
    },
    {
      "step_index": 3,
      "phase": "derive",
      "reasoning": "The retrieved password records can now be matched to the named apps, while the supplied task datetime and the instruction's March 1 boundary determine the minimum transaction date.",
      "action_code": "def select_app_password(password_records, app_name):\n    normalized = [(record['account_name'].strip().lower(), record['password']) for record in password_records]\n    exact = [password for name, password in normalized if name == app_name]\n    if len(exact) == 1:\n        return exact[0]\n    related = [password for name, password in normalized if app_name in name]\n    if len(related) == 1:\n        return related[0]\n    raise ValueError(f'Could not uniquely select credentials for {app_name}')\n\nphone_password = select_app_password(account_passwords, 'phone')\nvenmo_password = select_app_password(account_passwords, 'venmo')\ntask_datetime_iso = '2023-05-18T12:00:00'\nstart_date = task_datetime_iso[:4] + '-03-01'",
      "depends_on_steps": [
        2
      ],
      "api_names_used": [],
      "mutates_state": false,
      "verification_targets": [
        "Exactly one password is selected for each app without exposing it.",
        "The minimum date is represented in the Venmo API's documented YYYY-MM-DD format."
      ],
      "output_policy": "no_print"
    },
    {
      "step_index": 4,
      "phase": "authenticate",
      "reasoning": "The supervisor identifiers and derived app passwords are available, so log in and retain only token variables for subsequent reads.",
      "action_code": "phone_login_result = apis.phone.login(username=supervisor_profile['phone_number'], password=phone_password)\nphone_access_token = phone_login_result['access_token']\nvenmo_login_result = apis.venmo.login(username=supervisor_profile['email'], password=venmo_password)\nvenmo_access_token = venmo_login_result['access_token']",
      "depends_on_steps": [
        3
      ],
      "api_names_used": [
        "phone.login",
        "venmo.login"
      ],
      "mutates_state": false,
      "verification_targets": [
        "Phone and Venmo access tokens are stored without being printed."
      ],
      "output_policy": "no_print"
    },
    {
      "step_index": 5,
      "phase": "observe",
      "reasoning": "The authenticated phone API can identify contacts carrying the roommate relationship; paginate until the documented page size proves there are no further records.",
      "action_code": "roommate_contact_pages = []\ncontact_page_index = 0\nwhile True:\n    contact_page = apis.phone.search_contacts(access_token=phone_access_token, relationship='roommate', page_index=contact_page_index, page_limit=20)\n    roommate_contact_pages.extend(contact_page)\n    if len(contact_page) < 20:\n        break\n    contact_page_index += 1",
      "depends_on_steps": [
        4
      ],
      "api_names_used": [
        "phone.search_contacts"
      ],
      "mutates_state": false,
      "verification_targets": [
        "Every page of contacts filtered by the roommate relationship is retrieved."
      ],
      "output_policy": "no_print"
    },
    {
      "step_index": 6,
      "phase": "derive",
      "reasoning": "The complete contact results are available, so confirm the relationship from each public record, deduplicate usable emails, and expose only the resulting public candidates before querying Venmo.",
      "action_code": "roommate_contacts = [contact for contact in roommate_contact_pages if any(str(relationship).strip().lower() == 'roommate' for relationship in contact['relationships'])]\nroommate_emails = sorted({contact['email'].strip().lower() for contact in roommate_contacts if contact['email'].strip()})\nroommate_candidates = [{'name': (contact['first_name'] + ' ' + contact['last_name']).strip(), 'email': contact['email']} for contact in roommate_contacts if contact['email'].strip()]\nprint(roommate_candidates)",
      "depends_on_steps": [
        5
      ],
      "api_names_used": [],
      "mutates_state": false,
      "verification_targets": [
        "Only contacts whose returned relationships include roommate are selected.",
        "Roommate email addresses are deduplicated from real contact records."
      ],
      "output_policy": "public_records"
    },
    {
      "step_index": 7,
      "phase": "observe",
      "reasoning": "The roommate emails and start date are now grounded, so fetch every page of transactions between the supervisor and each roommate without applying a direction filter, thereby including both sent and received transactions.",
      "action_code": "transactions_by_id = {}\nfor roommate_email in roommate_emails:\n    transaction_page_index = 0\n    while True:\n        transaction_page = apis.venmo.show_transactions(access_token=venmo_access_token, user_email=roommate_email, min_created_at=start_date, page_index=transaction_page_index, page_limit=20)\n        for transaction in transaction_page:\n            transactions_by_id[transaction['transaction_id']] = transaction\n        if len(transaction_page) < 20:\n            break\n        transaction_page_index += 1\nprint({'roommate_count': len(roommate_emails), 'unique_transaction_count': len(transactions_by_id)})",
      "depends_on_steps": [
        6
      ],
      "api_names_used": [
        "venmo.show_transactions"
      ],
      "mutates_state": false,
      "verification_targets": [
        "All transaction pages are retrieved for every deduplicated roommate email.",
        "Duplicate transaction IDs, if any, are counted only once.",
        "Both sent and received directions remain included."
      ],
      "output_policy": "safe_aggregate"
    },
    {
      "step_index": 8,
      "phase": "derive",
      "reasoning": "All candidate transactions are stored, so verify their endpoints involve the supervisor and a selected roommate, then sum their monetary amounts in cents to avoid cumulative floating-point error.",
      "action_code": "self_email = supervisor_profile['email'].strip().lower()\nroommate_email_set = set(roommate_emails)\nqualifying_transactions = []\nfor transaction in transactions_by_id.values():\n    sender_email = transaction['sender']['email'].strip().lower()\n    receiver_email = transaction['receiver']['email'].strip().lower()\n    if (sender_email == self_email and receiver_email in roommate_email_set) or (receiver_email == self_email and sender_email in roommate_email_set):\n        qualifying_transactions.append(transaction)\ntotal_cents = sum(int(round(float(transaction['amount']) * 100)) for transaction in qualifying_transactions)\nanswer = total_cents / 100\nprint({'qualifying_transaction_count': len(qualifying_transactions), 'total_amount': answer})",
      "depends_on_steps": [
        7
      ],
      "api_names_used": [],
      "mutates_state": false,
      "verification_targets": [
        "Every included transaction is between the supervisor and a selected roommate.",
        "The answer combines amounts in both directions since the derived March 1 boundary.",
        "The monetary total is computed from integer cents."
      ],
      "output_policy": "safe_aggregate"
    },
    {
      "step_index": 9,
      "phase": "complete",
      "reasoning": "The concise monetary answer has been computed solely from verified public records, so submit that answer to complete the QA task.",
      "action_code": "completion_result = apis.supervisor.complete_task(answer=answer)",
      "depends_on_steps": [
        8
      ],